Link,Type,Name,Instructure,Level,Duration,Date created,Rating
https://www.pluralsight.com/courses/editing-dialogue-premiere-pro-2197,courses,Editing Dialogue in Premiere Pro,by Joshua Samson,Beginner,1h 38m,31-Jul-21,
https://www.pluralsight.com/courses/maya-dynamics-combining-ncloth-bifrost,courses,Maya Dynamics: Combining nCloth and Bifrost,by Todd Palamar,Intermediate,1h 32m,14-Dec-22,
https://www.pluralsight.com/courses/solidworks-consumer-product-surfacing-design-techniques,courses,SOLIDWORKS: Consumer Product Surfacing Design Techniques,by Matt Perez,Advanced,3h 44m,06-Dec-22,
https://www.pluralsight.com/courses/working-drawings-construction-documents-autocad-1534,courses,Creating Working Drawings for Your Construction Documents in AutoCAD,by Pierre Derenoncourt,Beginner,1h 26m,31-Jul-21,
https://www.pluralsight.com/courses/cartoon-style-char-blender-1982,courses,Creating a Cartoon-style Character in Blender,by Costas Frost,Intermediate,3h 58m,31-Jul-21,32.0
https://www.pluralsight.com/courses/swords-shovels-prototyping-game-systems,courses,Prototyping Game Systems for Swords and Shovels,by MJ Johns,Intermediate,2h 26m,14-Dec-22,23.0
https://www.pluralsight.com/courses/revit-collaboration-worksharing,courses,Collaboration in Revit: Worksharing,by Kory Cox,Beginner,35m,05-Dec-22,
https://www.pluralsight.com/courses/setting-construction-phases-revit-1411,courses,Setting Construction Phases in Revit,by Pierre Derenoncourt,Beginner,31m,31-Jul-21,
https://www.pluralsight.com/courses/fusion-360-simulation-getting-started,courses,Fusion 360 – Getting Started with Simulation,by Matt Perez,Intermediate,1h 33m,07-Dec-22,
https://www.pluralsight.com/courses/designing-electrical-circuits-revit-1485,courses,Designing Electrical Circuits in Revit,by Pierre Derenoncourt,Beginner,49m,31-Jul-21,
https://www.pluralsight.com/courses/solidworks-design-communication-documents-consumer-products,courses,SOLIDWORKS - Design Communication Documentation - Consumer Products,by Robert Murdock,Intermediate,1h 22m,15-Dec-22,
https://www.pluralsight.com/courses/transformable-flying-car-maya-silo-1293,courses,Creating a Transformable Flying Car in Maya and Silo,by Antony Ward,Advanced,4h 17m,31-Jul-21,
https://www.pluralsight.com/courses/responsive-product-emails-photoshop-1962,courses,Creating Responsive Product Emails in Photoshop and HTML,by Andy Mitchell,Intermediate,2h 31m,02-Feb-18,
https://www.pluralsight.com/courses/inventor-essentials-visual-styles-visualization-graphics,courses,"Inventor Essentials - Visual Styles, Visualization, and Graphics",by Neil Cross,Beginner,2h 31m,16-Dec-22,
https://www.pluralsight.com/courses/unity-2d-physics-fundamentals,courses,Unity 2D Physics Fundamentals,by Michael Taylor,Beginner,1h 33m,01-Dec-22,20.0
https://www.pluralsight.com/courses/guerrilla-commercial-design-concept-maya-617,courses,Guerrilla Commercial Design Concept in Maya,by Ed Whetstone,Advanced,2h 20m,12-Mar-19,
https://www.pluralsight.com/courses/compositing-teleportation-effect-after-effects-1092,courses,Compositing a Teleportation Effect in After Effects,by Brad Groatman,Advanced,2h 55m,09-Jul-19,
https://www.pluralsight.com/courses/simulating-flamethrower-effect-maya-1915,courses,Simulating a Flamethrower Effect in Maya,by Pankaj Malik,Advanced,1h 26m,31-Jul-21,11.0
https://www.pluralsight.com/courses/unreal-designing-motion-controller-experiences,courses,Designing Motion Controller Experiences in Unreal,by Nathan Glemboski,Intermediate,1h 44m,05-Dec-22,
https://www.pluralsight.com/courses/working-construction-template-revit-1746,courses,Working in the Construction Template in Revit,by Pierre Derenoncourt,Beginner,50m,31-Jul-21,
https://www.pluralsight.com/courses/taking-modeling-skills-next-level-rhino-1672,courses,Taking Your Modeling Skills to the Next Level in Rhino,by Adam Fairless,Advanced,3h 41m,31-Jul-21,
https://www.pluralsight.com/courses/swords-shovels-character-controller-ai,courses,Swords and Shovels Character Controller and AI,by Michael Baker,Intermediate,54m,14-Dec-22,70.0
https://www.pluralsight.com/courses/joint-based-facial-rigging-maya-1133,courses,Joint-based Facial Rigging in Maya,by Tim Callaway,Advanced,3h 26m,31-Jul-21,16.0
https://www.pluralsight.com/courses/aggregating-data-across-documents-mongodb,courses,Aggregating Data across Documents in MongoDB 4,by Axel Sirota,Advanced,1h 51m,02-Mar-22,35.0
https://www.pluralsight.com/courses/clean-transform-and-load-data-power-bi,courses,"Clean, Transform, and Load Data with Power BI",by Thomas LeBlanc,Intermediate,1h,17-Dec-22,45.0
https://www.pluralsight.com/courses/kafka-connect-fundamentals,courses,Kafka Connect Fundamentals,by Bogdan Sucaciu,Intermediate,2h 14m,24-Dec-19,52.0
https://www.pluralsight.com/courses/build-first-dashboard-power-bi,courses,Build Your First Dashboard with Power BI,by Matthew Calderwood,Beginner,1h 28m,16-Jul-20,50.0
https://www.pluralsight.com/courses/discovering-business-analysis-information-through-elicitation,courses,Discovering Business Analysis Information Through Elicitation,by Casey Ayers,Beginner,2h 35m,13-Dec-16,55.0
https://www.pluralsight.com/courses/building-first-scikit-learn-solution,courses,Building Your First scikit-learn Solution,by Janani Ravi,Beginner,2h 7m,02-May-19,125.0
https://www.pluralsight.com/courses/visualizing-data-pivotcharts,courses,Visualizing Data with PivotCharts,by Ben Howard,Advanced,1h 18m,11-Dec-19,156.0
https://www.pluralsight.com/courses/data-literacy-essentials-microsoft-azure-cognitive-services,courses,Data Literacy: Essentials of Microsoft Azure Cognitive Services,by JS Padoan,Beginner,38m,25-May-21,53.0
https://www.pluralsight.com/courses/tableau-desktop-building-effective-dashboards,courses,Building Effective Dashboards with Tableau Desktop,by Pooja Crahen,Advanced,3h 18m,11-Oct-19,53.0
https://www.pluralsight.com/courses/sql-server-optimize-data-manipulation-performance,courses,Optimize Data Manipulation Performance in SQL Server,by Pinal Dave,Beginner,27m,21-Feb-24,
https://www.pluralsight.com/courses/sql-server-advanced-query-optimization-techniques,courses,Advanced Query Optimization Techniques in SQL Server,by Pinal Dave,Beginner,30m,27-Jan-24,14.0
https://www.pluralsight.com/courses/managing-users-roles-privileges-oracle,courses,"Managing Users, Roles, and Privileges with Oracle",by Agaba Philip,Intermediate,38m,23-Nov-22,
https://www.pluralsight.com/courses/sql-server-query-tuning-action-real-world-scenarios,courses,Real-world Scenarios: SQL Server Query Tuning in Action,by Pinal Dave,Beginner,29m,05-Mar-24,
https://www.pluralsight.com/courses/sql-server-transactions-getting-started,courses,Getting Started with SQL Server Transactions,by Dayo Bamikole,Beginner,31m,15-Mar-24,
https://www.pluralsight.com/courses/sql-server-advanced-hierarchical-data-management,courses,Advanced Hierarchical Data Management in SQL Server,by Pinal Dave,Beginner,32m,13-Mar-24,
https://www.pluralsight.com/courses/sql-server-stored-procedures-automate-data-workflows,courses,Automate Data Workflows with SQL Server Stored Procedures,by Pinal Dave,Beginner,24m,21-Feb-24,
https://www.pluralsight.com/courses/langchain-intro-data-professionals,courses,Introduction to LangChain for Data Professionals,by Pinal Dave,Intermediate,38m,07-Dec-23,19.0
https://www.pluralsight.com/courses/sql-server-advanced-data-retrieval-techniques,courses,Advanced Data Retrieval Techniques in SQL Server,by Pinal Dave,Beginner,26m,13-Feb-24,11.0
https://www.pluralsight.com/courses/introduction-sql-server,courses,Introduction to SQL Server,by Ben Weissman,Beginner,1h 1m,12-Jul-23,41.0
https://www.pluralsight.com/courses/ssrs-data-sourcing-playbook,courses,SSRS Data Sourcing Playbook,by Amruta Mahajan,Beginner,1h 40m,14-Dec-20,13.0
https://www.pluralsight.com/courses/t-sql-data-manipulation-playbook,courses,T-SQL Data Manipulation Playbook,by Xavier Morera,Intermediate,2h 54m,27-Sep-19,100.0
https://www.pluralsight.com/courses/build-first-data-visualization-epoch,courses,Build Your First Data Visualization with Epoch,by Pinal Dave,Beginner,40m,01-Feb-21,14.0
https://www.pluralsight.com/courses/build-first-data-visualization-fusioncharts,courses,Build Your First Data Visualization with FusionCharts,by Pinal Dave,Beginner,47m,29-Jun-20,11.0
https://www.pluralsight.com/courses/build-first-data-visualization-google-charts,courses,Build Your First Data Visualization with Google Charts,by Pinal Dave,Beginner,48m,26-Mar-20,12.0
https://www.pluralsight.com/courses/identifying-understanding-business-problems-data-scientists,courses,Identifying and Understanding Business Problems for Data Scientists,by Pinal Dave,Intermediate,26m,16-Jan-24,
https://www.pluralsight.com/courses/time-series-sequences-predictions-tensorflow-developer-cert,courses,"TensorFlow Developer Certificate - Time Series, Sequences, and Predictions",by Pinal Dave,Beginner,1h 6m,27-Nov-23,
https://www.pluralsight.com/courses/tableau-desktop-collecting-preparing-data,courses,Collecting and Preparing Data for Tableau Desktop,by Pooja Crahen,Beginner,1h 23m,05-Feb-20,144.0
https://www.pluralsight.com/courses/build-first-dashboard-idashboards,courses,Build Your First Dashboard with iDashboards,by Tim Boles,Beginner,44m,23-Dec-20,
https://www.pluralsight.com/courses/sql-server-functions-smart-data-handling,courses,SQL Server Functions for Smart Data Handling,by Pinal Dave,Beginner,24m,16-Feb-24,
https://www.pluralsight.com/courses/data-sec-champ-sql-injection-prevention,courses,Data Security Champion: SQL Injection and Prevention,by Laurentiu Raducu,Beginner,9m,01-Feb-24,
https://www.pluralsight.com/courses/building-apex-applications-different-data-formats,courses,Building APEX Applications with Different Data Formats,by Tim Boles,Beginner,1h 4m,05-May-20,14.0
https://www.pluralsight.com/courses/rnns-deep-learning-sequences-time-series,courses,Recurrent Neural Networks (RNNs): Deep Learning for Sequences and Time Series,by Pinal Dave,Beginner,31m,03-Jan-24,10.0
https://www.pluralsight.com/courses/snowpro-core-snowflake-cloud-data-platform-features-architecture,courses,SnowPro Core: Snowflake Cloud Data Platform Features and Architecture,by Pinal Dave,Beginner,1h 2m,01-Nov-23,11.0
https://www.pluralsight.com/courses/grouping-data-bins-categories,courses,Grouping Data into Bins and Categories,by Pinal Dave,Beginner,53m,10-Oct-23,
https://www.pluralsight.com/courses/capturing-logic-stored-procedures-mariadb,courses,Capturing Logic with Stored Procedures in MariaDB,by Pinal Dave,Advanced,1h 9m,02-Dec-19,11.0
https://www.pluralsight.com/courses/adv-sql-queries-oracle-sql-server,courses,Advanced SQL Queries in Oracle and SQL Server,by Scott Hecht,Intermediate,4h 25m,01-Oct-21,604.0
https://www.pluralsight.com/courses/power-bi-data-import-playbook,courses,Power BI Data Import Playbook,by Rory Neary,Beginner,1h 46m,02-Dec-19,133.0
https://www.pluralsight.com/courses/microsoft-azure-data-exploring,courses,Exploring Data in Microsoft Azure Using Kusto Query Language and Azure Data Explorer,by Neeraj Kumar,Intermediate,2h 45m,23-Sep-19,22.0
https://www.pluralsight.com/courses/microsoft-azure-data-integrating,courses,Integrating Data in Microsoft Azure,by Marcelo Pastorino,Advanced,2h 23m,17-Jul-20,87.0
https://www.pluralsight.com/courses/power-bi-m-query-shape-data,courses,Querying and Shaping Data in Power BI Using M,by Eugene Meidinger,Intermediate,2h 36m,11-Sep-19,44.0
https://www.pluralsight.com/courses/getting-started-heroku,courses,Heroku-18: Getting Started,by Saravanan Dhandapani,Intermediate,1h 55m,25-Apr-22,11.0
https://www.pluralsight.com/courses/sql-server-error-handling,courses,Error Handling in SQL Server,by Faisal Memon,Beginner,38m,26-Feb-24,
https://www.pluralsight.com/courses/implementing-neural-network-solutions-enterprise-environments,courses,Implementing Neural Network Solutions in Enterprise Environments,by Tom Taulli,Beginner,33m,31-Jan-24,
https://www.pluralsight.com/courses/principles-data-quality-measures,courses,Principles for Data Quality Measures,by Niraj Joshi,Advanced,43m,26-Mar-21,70.0
https://www.pluralsight.com/courses/sql-server-getting-started-hierarchal-data,courses,Getting Started with Hierarchical Data in SQL Server,by JS Padoan,Beginner,31m,06-Feb-24,10.0
https://www.pluralsight.com/courses/handling-streaming-data-apache-pulsar,courses,Handling Streaming Data with Apache Pulsar 2,by Axel Sirota,Intermediate,2h 7m,03-Mar-22,11.0
https://www.pluralsight.com/courses/sql-server-functions-fundamentals,courses,SQL Server Functions Fundamentals: Building Your First Functions,by Ben Weissman,Beginner,20m,08-Feb-24,
https://www.pluralsight.com/courses/administering-ssrs,courses,Administering SSRS 2017,by Thomas LeBlanc,Advanced,1h 42m,02-Jun-22,
https://www.pluralsight.com/courses/data-modeling-querying-reporting-business-intelligence,courses,"Data Modeling, Querying, and Reporting for Business Intelligence",by Nikola Ilic,Intermediate,2h 46m,29-Aug-23,14.0
https://www.pluralsight.com/courses/optimizing-query-performance-columnstoreindexes,courses,Optimizing Query Performance with Columnstore Indexes,by Jared Westover,Intermediate,2h 33m,24-Aug-23,
https://www.pluralsight.com/courses/data-engineering-aws-machine-learning,courses,Data Engineering with AWS Machine Learning,by Kim Schmidt,Advanced,2h 55m,18-Jun-20,34.0
https://www.pluralsight.com/courses/exploring-web-scraping-python,courses,Exploring Web Scraping with Python,by Clarke Bishop,Beginner,1h 34m,06-Oct-20,131.0
https://www.pluralsight.com/courses/ssrs-report-publishing-playbook,courses,SSRS Report Publishing Playbook,by Javier Merino,Intermediate,2h,05-Feb-20,
https://www.pluralsight.com/courses/build-your-first-dashboard-clicdata,courses,Build Your First Dashboard with ClicData,by Emmanuel Segui,Beginner,34m,08-Dec-20,
https://www.pluralsight.com/courses/sql-server-power-bi-visualize-data-trends,courses,Visualize Data Trends with SQL Server and Power BI,by Bismark Adomako,Beginner,29m,07-Mar-24,
https://www.pluralsight.com/courses/sql-server-mastering-stored-procedures,courses,Mastering Stored Procedures in SQL Server,by Nikola Ilic,Beginner,30m,27-Feb-24,12.0
https://www.pluralsight.com/courses/querying-data-sql-server,courses,Querying Data with SQL Server,by Mihaela Danci,Beginner,1h 56m,12-Oct-23,33.0
https://www.pluralsight.com/courses/data-storage-processing-approaches-requirement-analysis,courses,Approaches to Requirement Analysis for Efficient Data Storage and Processing,by Dayo Bamikole,Intermediate,34m,24-Jul-23,
https://www.pluralsight.com/courses/build-conversational-ai-solution-microsoft-azure,courses,Build a Conversational AI Solution with Microsoft Azure,by Dayo Bamikole,Advanced,34m,14-Jul-21,12.0
https://www.pluralsight.com/courses/large-language-models-intro-data-practitioners,courses,Introduction to Large Language Models for Data Practitioners,by Russ Thomas,Intermediate,39m,04-Jan-24,11.0
https://www.pluralsight.com/courses/microsoft-azure-identifying-security-requirements-ai-solution,courses,Identifying Security Requirements of an AI Solution,by Brian Harrison,Beginner,1h 29m,12-Dec-19,14.0
https://www.pluralsight.com/courses/building-first-vba-module,courses,Building Your First VBA Module,by Mike McQuillan,Advanced,1h 58m,06-Nov-19,17.0
https://www.pluralsight.com/courses/data-warehousing-data-engineers,courses,Data Warehousing for Data Engineers,by Lucian Lazar,Beginner,47m,23-Jul-24,
https://www.pluralsight.com/courses/build-video-indexer-microsoft-azure-cognitive-service,courses,Build a Video Indexer with Microsoft Azure Cognitive Service,by Niraj Joshi,Intermediate,22m,11-May-21,23.0
https://www.pluralsight.com/courses/power-bi-power-query-data-preparation,courses,Data Preparation with Power Query in Power BI,by Ben Howard,Intermediate,17m,18-Jul-24,
https://www.pluralsight.com/courses/apache-airflow-monitor-maintain,courses,Monitor and Maintain Apache Airflow,by Janani Ravi,Intermediate,22m,30-Jul-24,
https://www.pluralsight.com/courses/big-data-engineers,courses,Big Data for Data Engineers,by Dayo Bamikole,Beginner,58m,02-Jul-24,
https://www.pluralsight.com/courses/apache-airflow-create-complex-dags-task-dependencies,courses,Create Complex DAGs and Task Dependencies with Apache Airflow,by Janani Ravi,Intermediate,22m,25-Jul-24,
https://www.pluralsight.com/courses/securing-ssrs-reporting-solutions,courses,Securing SSRS Reporting Solutions,by Stacia Misner Varga,Advanced,1h 56m,23-Dec-20,
https://www.pluralsight.com/courses/snowflake-up-running,courses,Up and Running with Snowflake,by Tom Taulli,Intermediate,45m,30-Jul-24,
https://www.pluralsight.com/courses/dax-formulas-power-bi-pivot-ssas,courses,"Getting Started with DAX Formulas in Power BI, Power Pivot, and SSAS",by Eugene Meidinger,Beginner,2h 58m,22-May-20,232.0
https://www.pluralsight.com/courses/power-bi-import-data,courses,Import Data into Power BI,by Tim Warner,Intermediate,45m,12-Jul-24,
https://www.pluralsight.com/courses/qlik-sense-load-prepare-data,courses,Loading and Preparing Data for Analysis in Qlik Sense,by Dixit Patel,Beginner,2h 17m,01-May-19,23.0
https://www.pluralsight.com/courses/build-first-dashboard-gooddata,courses,Build Your First Dashboard with GoodData,by Charles Nurse,Beginner,47m,22-Dec-20,
https://www.pluralsight.com/courses/big-data-amazon-web-services,courses,Big Data on Amazon Web Services,by Andrew Brust,Intermediate,3h 54m,26-Aug-21,181.0
https://www.pluralsight.com/courses/tableau-certified-data-analyst-connect-transform-data-cert,courses,Tableau Certified Data Analyst: Connect to and Transform Data,"by Jason Browning, Ph.D.",Beginner,1h 40m,11-Jul-24,
https://www.pluralsight.com/courses/microsoft-azure-building-streaming-data-pipelines,courses,Building Streaming Data Pipelines in Microsoft Azure,by Reza Salehi,Intermediate,3h 2m,30-Jun-20,60.0
https://www.pluralsight.com/courses/adv-text-analytics-topic-model-named-entity-recog,courses,Advanced Text Analytics: Topic Modeling and Named Entity Recognition,by Ria Cheruvu,Intermediate,40m,13-Mar-24,
https://www.pluralsight.com/courses/apache-airflow-create-dynamic-dags,courses,Create Dynamic DAGs with Apache Airflow,by Matt Stenzel,Intermediate,16m,15-Jul-24,
https://www.pluralsight.com/courses/pre-trained-llms-build-solutions,courses,Build Solutions with Pre-trained LLMs,by Ria Cheruvu,Intermediate,38m,10-Jan-24,10.0
https://www.pluralsight.com/courses/model-evaluation-selection-scikit-learn,courses,Model Evaluation and Selection Using scikit-learn,by Chetan Prabhu,Intermediate,1h 17m,22-Nov-19,19.0
https://www.pluralsight.com/courses/data-sec-champ-data-privacy-ethics,courses,Data Security Champion: Data Privacy and Ethics,by Kevin James,Beginner,12m,15-Mar-24,
https://www.pluralsight.com/courses/build-first-data-visualization-matplotlib,courses,Build Your First Data Visualization with Matplotlib,by Martin Burger,Beginner,1h 8m,16-Apr-20,
https://www.pluralsight.com/courses/creating-visualizations-r-ggplot2-playbook,courses,Creating Visualizations in R Using ggplot2: R Playbook,by Emilee McWilliams,Beginner,1h 10m,26-Nov-19,
https://www.pluralsight.com/courses/power-bi-data-preparation-playbook,courses,Power BI Data Preparation Playbook,by Eugene Meidinger,Intermediate,2h 2m,29-Apr-19,100.0
https://www.pluralsight.com/courses/build-your-first-dashboard-dundas-bi,courses,Build Your First Dashboard with Dundas BI,by Venkatesh Muniyandi,Beginner,1h 16m,05-May-21,
https://www.pluralsight.com/courses/build-your-first-data-visualization-amcharts,courses,Build Your First Data Visualization with amCharts 4,by Ervis Trupja,Beginner,45m,08-Jun-22,
https://www.pluralsight.com/courses/implementing-data-visualizations,courses,Implementing Data Visualizations,by Mihaela Danci,Intermediate,2h 20m,04-Sep-20,41.0
https://www.pluralsight.com/courses/monitoring-requirements-evaluating-business-analysis-solutions,courses,Monitoring Requirements & Evaluating Business Analysis Solutions,by Casey Ayers,Intermediate,2h 12m,13-Dec-16,43.0
https://www.pluralsight.com/courses/sql-server-real-time-iot-data-stream-analysis,courses,Real-time IoT Data Stream Analysis with SQL Server,by JS Padoan,Beginner,35m,13-Jun-24,
https://www.pluralsight.com/courses/prevent-overfitting-model-training,courses,Prevent Overfitting in Model Training,by Saravanan Dhandapani,Beginner,33m,20-Dec-23,
https://www.pluralsight.com/courses/snowflake-analyze-semi-structured-data,courses,Analyze Semi-structured Data in Snowflake,by Warner Chaves,Intermediate,19m,15-Jul-24,
https://www.pluralsight.com/courses/sql-server-integrate-transactions-error-handling,courses,Integrate Transactions and Error Handling in SQL Server,by Chris Behrens,Beginner,30m,06-Feb-24,
https://www.pluralsight.com/courses/exploring-data-visually-r,courses,Exploring Data Visually with R,by Martin Burger,Beginner,2h 1m,07-Oct-19,
https://www.pluralsight.com/courses/power-bi-intermediate-power-query-techniques,courses,Intermediate Power Query Techniques in Power BI,by Avdhesh Gaur,Intermediate,18m,03-Jul-24,
https://www.pluralsight.com/courses/create-model-calculations-using-dax,courses,Create Model Calculations by Using DAX,by Brent Allen,Intermediate,1h 13m,06-Mar-24,11.0
https://www.pluralsight.com/courses/certified-analytics-professional-analytics-problem-framing,courses,Certified Analytics Professional: Analytics Problem Framing,by Brayden Ross,Intermediate,1h 17m,14-Apr-23,
https://www.pluralsight.com/courses/machine-learning-leaders,courses,Machine Learning for Leaders,by AWS,Beginner,10m,06-Oct-20,
https://www.pluralsight.com/courses/java-machine-learning-environments,courses,Exploring Java Machine Learning Environments,by Nicolae Caprarescu,Intermediate,1h 36m,17-Feb-21,
https://www.pluralsight.com/courses/what-is-artificial-intelligence,courses,What is Artificial Intelligence?,by AWS,Beginner,19m,06-Oct-20,301.0
https://www.pluralsight.com/courses/data-sessions-chatgpt-roundtable-discussion,courses,The Data Sessions: ChatGPT Roundtable Discussion with Pluralsight Experts,by Pluralsight Skills,Beginner,57m,22-Aug-23,12.0
https://www.pluralsight.com/courses/microsoft-azure-cleaning-preparing-data,courses,Cleaning and Preparing Data in Microsoft Azure,by Jared Rhodes,Beginner,1h 7m,16-Dec-19,
https://www.pluralsight.com/courses/querying-converting-data-types-r,courses,Querying and Converting Data Types in R,by Martin Burger,Beginner,2h 6m,15-Aug-19,16.0
https://www.pluralsight.com/courses/recommendation-systems-tensorflow-gcp,courses,Recommendation Systems with TensorFlow on GCP,by Google Cloud,Advanced,6h 46m,15-Apr-20,
https://www.pluralsight.com/courses/so-you-want-to-be-a-business-analyst,courses,So You Want to Be a Business Analyst,by Casey Ayers,Beginner,1h 50m,05-Oct-18,132.0
https://www.pluralsight.com/courses/putting-people-first-as-business-analyst,courses,Putting People First as a Business Analyst,by Heather Mylan-Mains,Beginner,1h 38m,28-Jun-19,40.0
https://www.pluralsight.com/courses/nlp-models-working-pre-trained,courses,Working with Pre-trained NLP Models,by Axel Sirota,Beginner,40m,24-Jan-24,
https://www.pluralsight.com/courses/machine-learning-operations-mlops-getting-started-1,courses,Machine Learning Operations (MLOps): Getting Started,by Google Cloud,Beginner,1h 3m,23-Aug-23,
https://www.pluralsight.com/courses/bigquery-fundamentals-snowflake-professionals,courses,BigQuery Fundamentals for Snowflake Professionals,by Google Cloud,Beginner,1m,25-Apr-24,
https://www.pluralsight.com/courses/bigquery-fundamentals-teradata-professionals,courses,BigQuery Fundamentals for Teradata Professionals,by Google Cloud,Beginner,1m,24-Apr-24,
https://www.pluralsight.com/courses/hadoop-cloudera-cluster-databases,courses,Preparing a Production Hadoop Cluster with Cloudera: Databases,by Xavier Morera,Beginner,1h 31m,22-Jul-24,15.0
https://www.pluralsight.com/courses/python-sqlalchemy-playbook-understanding-databases,courses,Understanding Databases with SQLAlchemy 1: Python Data Playbook,by Xavier Morera,Beginner,1h 23m,22-Jul-24,52.0
https://www.pluralsight.com/courses/managing-azure-sql-server-database-performance,courses,Managing Azure SQL Server Database Performance,by Hugo Barona,Advanced,1h 32m,20-Jun-24,54.0
https://www.pluralsight.com/courses/microsoft-azure-sql-data-warehouse-sql-database-deploying,courses,Deploying Microsoft Azure Synapse Analytics and Azure SQL Database,by Robert Lindley,Intermediate,1h 58m,01-Nov-23,55.0
https://www.pluralsight.com/labs/aws/configure-dynamodb-auto-scaling-aws,labs,Configure DynamoDB Auto Scaling on AWS,by Mayank Pandey,Intermediate,15m,02-Sep-21,65.0
https://www.pluralsight.com/labs/aws/deploy-application-using-elastic-beanstalk-aws,labs,Deploy an Application Using Elastic Beanstalk on AWS,by Carlos Souza,Intermediate,45m,01-Feb-22,572.0
https://www.pluralsight.com/labs/aws/monitor-amazon-neptune-database,labs,Monitor an Amazon Neptune Database,by Jeff Hopper,Intermediate,1h 6m,15-Sep-21,
https://www.pluralsight.com/labs/aws/create-load-query-data-amazon-aurora-serverless,labs,"Create, Load, and Query Data on Amazon Aurora Serverless",by Asmin Bhandari,Intermediate,55m,19-Aug-21,15.0
https://www.pluralsight.com/labs/aws/create-clones-replicas-amazon-neptune-databases-instances,labs,Create Clones and Replicas of Amazon Neptune Databases and Instances,by Jeff Hopper,Intermediate,32m,15-Jun-21,
https://www.pluralsight.com/labs/aws/create-configure-rds-database-for-high-availability-aws,labs,Create and Configure an RDS Database for High Availability on AWS,by Jeff Hopper,Intermediate,30m,22-Jun-21,142.0
https://www.pluralsight.com/labs/azure/create-test-sql-database-microsoft-azure,labs,Microsoft Azure Lab: How to Create and Test a SQL Database,by Bismark Adomako,Intermediate,20m,19-Sep-22,743.0
https://www.pluralsight.com/labs/aws/upgrade-amazon-rds-postgres-database-to-new-engine-version,labs,Amazon RDS Postgres Database Lab: Upgrading to a New Engine Version,by Wes Novack,Intermediate,25m,02-Jul-21,
